{
  "version": "1.0.0",
  "last_reviewed_at": "2026-06-01",
  "description": "Registry of source inputs Dutiva ingests or tracks for the Advisor and internal HR document systems.",
  "source_types": [
    "Law",
    "Regulation",
    "Government guide",
    "Internal Dutiva template",
    "Internal Dutiva policy",
    "HR best-practice guidance",
    "PR/internal communications guidance"
  ],
  "sources": [
    {
      "source_id": "law-canada-federal-l2",
      "source_name": "Canada Labour Code",
      "source_type": "Law",
      "jurisdiction": "Canada (Federal)",
      "url": "https://github.com/justicecanada/laws-lois-xml/blob/main/eng/acts/L-2.xml",
      "language": "English",
      "authority_level": "Primary law",
      "last_checked_at": "2026-04-30",
      "last_updated_at": "2026-04-30",
      "status": "active",
      "notes": "MVP source. Local raw file: advisor-training/raw-laws/canada/federal/acts/L-2.xml. Included in parsed, normalized, guidance, and data/advisor-guidance-index.json outputs."
    },
    {
      "source_id": "law-canada-federal-h6",
      "source_name": "Canadian Human Rights Act",
      "source_type": "Law",
      "jurisdiction": "Canada (Federal)",
      "url": "https://github.com/justicecanada/laws-lois-xml/blob/main/eng/acts/H-6.xml",
      "language": "English",
      "authority_level": "Primary law",
      "last_checked_at": "2026-04-30",
      "last_updated_at": "2026-04-30",
      "status": "active",
      "notes": "MVP source. Local raw file: advisor-training/raw-laws/canada/federal/acts/H-6.xml. Included in parsed, normalized, guidance, and data/advisor-guidance-index.json outputs."
    },
    {
      "source_id": "reg-canada-federal-crc-c-986",
      "source_name": "Canada Labour Standards Regulations",
      "source_type": "Regulation",
      "jurisdiction": "Canada (Federal)",
      "url": "https://github.com/justicecanada/laws-lois-xml/blob/main/eng/regulations/C.R.C.,_c._986.xml",
      "language": "English",
      "authority_level": "Primary regulation",
      "last_checked_at": "2026-04-30",
      "last_updated_at": "2026-04-30",
      "status": "active",
      "notes": "MVP source. Local raw file: advisor-training/raw-laws/canada/federal/regulations/C.R.C.-c-986.xml. Included in parsed, normalized, guidance, and data/advisor-guidance-index.json outputs."
    },
    {
      "source_id": "reg-canada-federal-sor-2020-130",
      "source_name": "Work Place Harassment and Violence Prevention Regulations",
      "source_type": "Regulation",
      "jurisdiction": "Canada (Federal)",
      "url": "https://laws-lois.justice.gc.ca/eng/regulations/SOR-2020-130/",
      "language": "English",
      "authority_level": "Primary regulation",
      "last_checked_at": "2026-05-31",
      "last_updated_at": "2026-05-28",
      "status": "planned",
      "notes": "Tracked for Phase 1b. The source is available on Justice Laws, but local raw XML has not been added and this regulation is not yet included in the guidance index."
    },
    {
      "source_id": "guide-canada-federal-labour-standards",
      "source_name": "Federal labour standards guide",
      "source_type": "Government guide",
      "jurisdiction": "Canada (Federal)",
      "url": "https://www.canada.ca/en/services/jobs/workplace/federal-labour-standards.html",
      "language": "English",
      "authority_level": "Official government guidance",
      "last_checked_at": "2026-05-31",
      "last_updated_at": "2025-04-30",
      "status": "planned",
      "notes": "Official ESDC/Labour Program guide source tracked for future guided-content ingestion. It is not currently part of the MVP law XML pipeline."
    },
    {
      "source_id": "law-ontario-esa-2000",
      "source_name": "Employment Standards Act, 2000",
      "source_type": "Law",
      "jurisdiction": "Ontario",
      "url": "https://www.ontario.ca/laws/statute/00e41",
      "language": "English",
      "authority_level": "Primary law",
      "last_checked_at": "2026-06-01",
      "last_updated_at": null,
      "status": "planned",
      "notes": "Tracked source for Ontario employment standards coverage. Place raw XML under advisor-training/raw-laws/canada/ontario/acts/ (auto-labelled 'Ontario' by advisor-training/pipelines/jurisdiction.ts) and run npm run pipeline:all. Interim coverage is provided by curated bilingual ON entries in src/retrieval/retrieveGuidance.ts. See advisor-training/PROVINCIAL_INGESTION.md."
    },
    {
      "source_id": "guide-ontario-esa",
      "source_name": "Your guide to the Employment Standards Act",
      "source_type": "Government guide",
      "jurisdiction": "Ontario",
      "url": "https://www.ontario.ca/document/your-guide-employment-standards-act-0",
      "language": "English",
      "authority_level": "Official government guidance",
      "last_checked_at": "2026-06-01",
      "last_updated_at": "2026-02-05",
      "status": "planned",
      "notes": "Official Ontario guide source tracked for future guided-content ingestion and source-citation review."
    },
    {
      "source_id": "law-quebec-labour-standards",
      "source_name": "Act respecting labour standards",
      "source_type": "Law",
      "jurisdiction": "Quebec",
      "url": "https://www.legisquebec.gouv.qc.ca/en/document/cs/N-1.1",
      "language": "Bilingual",
      "authority_level": "Primary law",
      "last_checked_at": "2026-06-01",
      "last_updated_at": null,
      "status": "planned",
      "notes": "Tracked source for Quebec labour-standards coverage. Place raw XML under advisor-training/raw-laws/canada/quebec/lois/ (auto-labelled 'Quebec'). Québec is officially bilingual — ingest BOTH the EN and FR files so build-guidance-layer emits validated advisor_answer_fr. Interim coverage is provided by curated bilingual QC entries in src/retrieval/retrieveGuidance.ts. See advisor-training/PROVINCIAL_INGESTION.md."
    },
    {
      "source_id": "law-quebec-charter-french-language",
      "source_name": "Charter of the French Language",
      "source_type": "Law",
      "jurisdiction": "Quebec",
      "url": "https://www.legisquebec.gouv.qc.ca/en/document/cs/C-11",
      "language": "Bilingual",
      "authority_level": "Primary law",
      "last_checked_at": "2026-06-01",
      "last_updated_at": null,
      "status": "planned",
      "notes": "Tracked source for Quebec French-language workplace, contract, and policy obligations. Review before moving Quebec templates from partial to full coverage."
    },
    {
      "source_id": "template-dutiva-generator-library",
      "source_name": "Dutiva HR document generator templates",
      "source_type": "Internal Dutiva template",
      "jurisdiction": "Canada",
      "url": "https://github.com/Dutiva-Canada/Dutiva/tree/main/src/lib/generator/templates",
      "language": "English",
      "authority_level": "Internal Dutiva product source",
      "last_checked_at": "2026-05-31",
      "last_updated_at": "2026-05-31",
      "status": "active",
      "notes": "Internal source library for generated HR documents. Current template set is stored under src/lib/generator/templates with paired TypeScript and generated JavaScript files."
    },
    {
      "source_id": "policy-dutiva-advisor-safety",
      "source_name": "Dutiva Advisor safety and escalation policies",
      "source_type": "Internal Dutiva policy",
      "jurisdiction": "Canada",
      "url": "https://github.com/Dutiva-Canada/Dutiva/tree/main/advisor-training/safety",
      "language": "English",
      "authority_level": "Internal Dutiva policy",
      "last_checked_at": "2026-05-31",
      "last_updated_at": "2026-05-31",
      "status": "active",
      "notes": "Internal policy source for legal-boundary and escalation behavior. Files include advisor-training/safety/legal-boundaries.md and advisor-training/safety/escalation-rules.md."
    },
    {
      "source_id": "guidance-dutiva-hr-knowledge-base",
      "source_name": "Dutiva Canadian HR compliance knowledge base",
      "source_type": "HR best-practice guidance",
      "jurisdiction": "Canada",
      "url": "https://github.com/Dutiva-Canada/Dutiva/tree/main/advisor-training/knowledge-base",
      "language": "English",
      "authority_level": "Internal Dutiva guidance",
      "last_checked_at": "2026-05-31",
      "last_updated_at": "2026-05-31",
      "status": "active",
      "notes": "Internal best-practice guidance source for Canadian HR compliance and jurisdictional framing. Files include advisor-training/knowledge-base/canadian-hr-compliance.md and jurisdictions.md."
    },
    {
      "source_id": "guidance-dutiva-response-style",
      "source_name": "Dutiva Advisor response style and example guidance",
      "source_type": "PR/internal communications guidance",
      "jurisdiction": "Canada",
      "url": "https://github.com/Dutiva-Canada/Dutiva/tree/main/advisor-training/prompts",
      "language": "English",
      "authority_level": "Internal Dutiva communications guidance",
      "last_checked_at": "2026-05-31",
      "last_updated_at": "2026-05-31",
      "status": "active",
      "notes": "Internal communications guidance source for Advisor tone, response structure, and example responses. Related files live under advisor-training/prompts and advisor-training/examples."
    }
  ]
}
